{
  "schema_version": 1,
  "generated": "2026-07-17T15:03:58+00:00",
  "model": "best.pt",
  "run": "baseline3",
  "conf_threshold": 0.25,
  "iou_threshold": 0.7,
  "classes": [
    "Anchovies",
    "Boiled-Egg",
    "Char-Kuey-Teow",
    "Chicken-Rendang",
    "Curry-Puff",
    "Fried-Chicken",
    "Fried-Egg",
    "Fried-Rice",
    "Hokkien-Mee",
    "Lo-Mein",
    "Mee-Rebus",
    "Mee-Siam",
    "Peanuts",
    "Rice",
    "Roti-Canai",
    "Sambal",
    "Slices-Cucumber"
  ],
  "predictions": [
    {
      "image_id": "10_webp.rf.e29ba1799e124d5a6aa6c6f59f040beb.jpg",
      "image_size": [
        320,
        320
      ],
      "boxes": [
        {
          "class": "Lo-Mein",
          "class_id": 9,
          "conf": 0.5682,
          "xyxy": [
            0.0,
            106.02,
            319.35,
            313.37
          ]
        },
        {
          "class": "Boiled-Egg",
          "class_id": 1,
          "conf": 0.3858,
          "xyxy": [
            0.45,
            0.07,
            167.63,
            71.47
          ]
        }
      ]
    },
    {
      "image_id": "11_webp.rf.7e0faa1eee6a29f7d9a0819dbeb9baa8.jpg",
      "image_size": [
        320,
        320
      ],
      "boxes": [
        {
          "class": "Fried-Rice",
          "class_id": 7,
          "conf": 0.9363,
          "xyxy": [
            69.62,
            63.06,
            319.73,
            250.01
          ]
        }
      ]
    },
    {
      "image_id": "13_jpg.rf.ac3a5faaafd2e352ed164b8f3c6f5f38.jpg",
      "image_size": [
        320,
        320
      ],
      "boxes": [
        {
          "class": "Mee-Siam",
          "class_id": 11,
          "conf": 0.7149,
          "xyxy": [
            31.94,
            107.88,
            233.54,
            247.71
          ]
        },
        {
          "class": "Fried-Rice",
          "class_id": 7,
          "conf": 0.4067,
          "xyxy": [
            32.25,
            108.1,
            234.41,
            247.91
          ]
        }
      ]
    },
    {
      "image_id": "14_webp.rf.f7afa160222f2bf1a5c37a565f5929e8.jpg",
      "image_size": [
        320,
        320
      ],
      "boxes": [
        {
          "class": "Mee-Siam",
          "class_id": 11,
          "conf": 0.8244,
          "xyxy": [
            59.52,
            84.37,
            257.46,
            302.14
          ]
        }
      ]
    },
    {
      "image_id": "16_jpg.rf.dceeb41479a7e12ff656956a1fb3858a.jpg",
      "image_size": [
        320,
        320
      ],
      "boxes": [
        {
          "class": "Roti-Canai",
          "class_id": 14,
          "conf": 0.9608,
          "xyxy": [
            158.89,
            64.06,
            319.76,
            320.0
          ]
        },
        {
          "class": "Roti-Canai",
          "class_id": 14,
          "conf": 0.954,
          "xyxy": [
            10.79,
            54.25,
            148.8,
            288.7
          ]
        }
      ]
    },
    {
      "image_id": "19_jpg.rf.b8b90de64b4b570adcc6f878817f827b.jpg",
      "image_size": [
        320,
        320
      ],
      "boxes": [
        {
          "class": "Lo-Mein",
          "class_id": 9,
          "conf": 0.9753,
          "xyxy": [
            2.27,
            39.74,
            318.25,
            279.06
          ]
        }
      ]
    },
    {
      "image_id": "19_png.rf.2774cfbe0a2bf73c7a70a1a16f42a500.jpg",
      "image_size": [
        320,
        320
      ],
      "boxes": [
        {
          "class": "Curry-Puff",
          "class_id": 4,
          "conf": 0.9377,
          "xyxy": [
            8.39,
            64.23,
            140.66,
            223.19
          ]
        },
        {
          "class": "Curry-Puff",
          "class_id": 4,
          "conf": 0.9069,
          "xyxy": [
            75.61,
            143.04,
            275.62,
            275.44
          ]
        },
        {
          "class": "Curry-Puff",
          "class_id": 4,
          "conf": 0.7462,
          "xyxy": [
            122.31,
            56.61,
            280.98,
            172.22
          ]
        }
      ]
    },
    {
      "image_id": "19_png.rf.8ff97659400b7081e72ba39a9f1ed27a.jpg",
      "image_size": [
        320,
        320
      ],
      "boxes": [
        {
          "class": "Mee-Rebus",
          "class_id": 10,
          "conf": 0.965,
          "xyxy": [
            43.61,
            30.41,
            283.18,
            275.39
          ]
        }
      ]
    },
    {
      "image_id": "1_jpg.rf.a4f211e4a2081394944d702d82207fdd.jpg",
      "image_size": [
        320,
        320
      ],
      "boxes": [
        {
          "class": "Lo-Mein",
          "class_id": 9,
          "conf": 0.704,
          "xyxy": [
            1.88,
            29.44,
            319.66,
            313.26
          ]
        },
        {
          "class": "Hokkien-Mee",
          "class_id": 8,
          "conf": 0.6761,
          "xyxy": [
            1.17,
            30.89,
            319.71,
            311.32
          ]
        }
      ]
    },
    {
      "image_id": "1_webp.rf.add2ccec42df6dc10070f64fa732d868.jpg",
      "image_size": [
        320,
        320
      ],
      "boxes": [
        {
          "class": "Lo-Mein",
          "class_id": 9,
          "conf": 0.9699,
          "xyxy": [
            0.0,
            11.2,
            319.09,
            320.0
          ]
        }
      ]
    },
    {
      "image_id": "20_jpg.rf.f8652ec57857cb2ed3bd66d66f61bb7d.jpg",
      "image_size": [
        320,
        320
      ],
      "boxes": [
        {
          "class": "Mee-Rebus",
          "class_id": 10,
          "conf": 0.9552,
          "xyxy": [
            17.44,
            23.07,
            303.67,
            296.14
          ]
        }
      ]
    },
    {
      "image_id": "21_jpeg.rf.44c9905392855001dbc4ad873e188879.jpg",
      "image_size": [
        320,
        320
      ],
      "boxes": [
        {
          "class": "Boiled-Egg",
          "class_id": 1,
          "conf": 0.8683,
          "xyxy": [
            150.73,
            123.79,
            191.67,
            182.66
          ]
        },
        {
          "class": "Mee-Siam",
          "class_id": 11,
          "conf": 0.3018,
          "xyxy": [
            33.06,
            61.44,
            295.43,
            280.73
          ]
        }
      ]
    },
    {
      "image_id": "21_jpg.rf.6630e3564ee329233bb26a1e0601e722.jpg",
      "image_size": [
        320,
        320
      ],
      "boxes": [
        {
          "class": "Mee-Siam",
          "class_id": 11,
          "conf": 0.9433,
          "xyxy": [
            65.56,
            20.53,
            317.92,
            318.82
          ]
        }
      ]
    },
    {
      "image_id": "21_jpg.rf.9c0aff28c8a487b20f614ad9bf9d1677.jpg",
      "image_size": [
        320,
        320
      ],
      "boxes": [
        {
          "class": "Curry-Puff",
          "class_id": 4,
          "conf": 0.9798,
          "xyxy": [
            193.79,
            125.71,
            303.36,
            218.83
          ]
        },
        {
          "class": "Curry-Puff",
          "class_id": 4,
          "conf": 0.9707,
          "xyxy": [
            0.13,
            163.85,
            106.54,
            266.97
          ]
        },
        {
          "class": "Curry-Puff",
          "class_id": 4,
          "conf": 0.9624,
          "xyxy": [
            145.17,
            185.06,
            242.41,
            299.43
          ]
        },
        {
          "class": "Curry-Puff",
          "class_id": 4,
          "conf": 0.9417,
          "xyxy": [
            66.29,
            211.81,
            158.09,
            319.98
          ]
        },
        {
          "class": "Curry-Puff",
          "class_id": 4,
          "conf": 0.8855,
          "xyxy": [
            0.0,
            87.04,
            91.67,
            177.23
          ]
        },
        {
          "class": "Curry-Puff",
          "class_id": 4,
          "conf": 0.7822,
          "xyxy": [
            203.78,
            50.93,
            289.74,
            139.08
          ]
        },
        {
          "class": "Curry-Puff",
          "class_id": 4,
          "conf": 0.6043,
          "xyxy": [
            91.99,
            57.76,
            153.17,
            211.52
          ]
        }
      ]
    },
    {
      "image_id": "22_jpg.rf.cbf2669ce8ff9e21035ca55adc6cf387.jpg",
      "image_size": [
        320,
        320
      ],
      "boxes": [
        {
          "class": "Mee-Siam",
          "class_id": 11,
          "conf": 0.9206,
          "xyxy": [
            0.48,
            79.65,
            222.45,
            320.0
          ]
        }
      ]
    },
    {
      "image_id": "23_jpeg.rf.cae188a8355dd7fe3055a889d887217e.jpg",
      "image_size": [
        320,
        320
      ],
      "boxes": [
        {
          "class": "Hokkien-Mee",
          "class_id": 8,
          "conf": 0.9187,
          "xyxy": [
            0.0,
            76.68,
            319.86,
            300.49
          ]
        }
      ]
    },
    {
      "image_id": "24_jpg.rf.04114faddcd3ec3d805681f1b79ef4c8.jpg",
      "image_size": [
        320,
        320
      ],
      "boxes": [
        {
          "class": "Char-Kuey-Teow",
          "class_id": 2,
          "conf": 0.9014,
          "xyxy": [
            71.78,
            20.24,
            276.92,
            281.22
          ]
        },
        {
          "class": "Boiled-Egg",
          "class_id": 1,
          "conf": 0.6496,
          "xyxy": [
            0.0,
            251.82,
            23.32,
            314.8
          ]
        }
      ]
    },
    {
      "image_id": "24_webp.rf.e611224961c2b2fb370aeb7075bd8140.jpg",
      "image_size": [
        320,
        320
      ],